filename,number,datetime,text,title,edited
"audio_91@05-08-2024_17-33-22.ogg,audio_92@05-08-2024_17-33-43.ogg,audio_93@05-08-2024_17-33-51.ogg,audio_94@05-08-2024_17-34-04.ogg","91,92,93,94",2024-08-05 17:33:22,"okay so actually for the newsletter check the Trello cart there are many things there and the newsletter is just one of the things I saw that you had a chat with Valeria maybe she I don't know if you talked about that but maybe you can ask her what exactly she uses now for creating the newsletter and how she does that and then when you go through the all the process documents you'll find the relevant ones but yeah so typically the way it works is there is a template and you create a copy of that template it's like a draft and then you fill in some things there one of them is podcast episode but typically you don't need to do typically Valeria is doing that you just now create like a pre-filled template this is something there is something you can create there too and then you also use chat GPT for that but this ask Valeria if something is not clear yeah and check the Trello cart for the newsletter all right you had a chat with her today and this question is not from today right i somehow missed it um yeah anyways let me know if you still need help with that i'll try to see what i can do By the way, how is it going with the migration project? Again, for this one you need to talk to Valeria.",Newsletter and Migration Project Update,"For the newsletter, please check the Trello card, as it contains many items, with the newsletter being just one of them. I noticed you had a chat with Valeria, so it might be helpful to ask her what tools she currently uses to create the newsletter and her process for doing so. As you review the process documents, you'll find the relevant ones.

Typically, the workflow involves using a template, where you create a copy that serves as a draft. You fill in various details, one of which is the podcast episode, though usually, Valeria handles this part. You can also create a pre-filled template and utilize ChatGPT for assistance. If anything is unclear, it's best to consult Valeria.

By the way, how is the migration project progressing? For questions regarding that, you will need to talk to Valeria as well. Let me know if you still need help with the newsletter; I’ll do my best to assist."
"audio_95@05-08-2024_17-37-03.ogg,audio_96@05-08-2024_17-37-40.ogg","95,96",2024-08-05 17:37:03,"So let me repeat that. Let me just go over this. So for the podcast, we schedule it live, yes, and then we do it on YouTube. At the same time, I record it locally. So locally, there is an mp3 file that I upload to Dropbox. When we do that, Dave, our podcast editor, should automatically see it. If he does not, I think typically we also let him know that there is a new podcast episode. I don't think it's necessary because he gets an invite. He gets a notification about that. So I don't think you need to reach out to him. So there is a process. He will just let you know that, yeah, it's done. But also, there is a special notification email. I recently forwarded you that email. So you will be receiving those emails when Dave uploads something to the Dropbox folder. We will receive a notification, you, me, and it also goes to the to-do list. Then you take the mp3 file, the edited file, and upload to Spotify for Podcasters. Yes, and it distributes it to Spotify, Apple Podcasts, Google Podcasts, whatever automatically. And then you get the links after it goes live. So before, when you schedule, you don't have the links. When it's published, when it goes live at 5 or 7 p.m. Berlin time on Friday, only then you will have a link to Spotify and Apple Podcasts. You will not have the links before, only after. So that's why you need to get these links and fill in the form. You perform the GitHub task, create a page. But yeah basically that's it. Also talk to Valeria because she might have an idea how exactly you can pre-fill it in the best possible way. And then of course once you agree on the way it should be done we should document everything. So now you're getting familiar with the process documents but soon I think you'll know your way around them more or less. And then this is when you should probably keep track of things you now learned somewhere. Included maybe also in the onboarding document. But then yeah you come back to those processes and you revise them. We will also do document by document. We will check them how relevant and up to date they are. So we will do this soon too.",Podcast Editing Process,"For the podcast, we schedule it to be live on YouTube while simultaneously recording it locally. The local recording generates an MP3 file that I upload to Dropbox. Our podcast editor, Dave, should automatically see this new file. If he doesn’t, typically we inform him about the new episode, although he usually receives a notification about it.

Once Dave completes the editing, he will let us know. Additionally, I recently forwarded you a special notification email that alerts us when Dave uploads something to the Dropbox folder. This notification goes to both you and me, and it also populates our to-do list. 

After that, you will take the edited MP3 file and upload it to Spotify for Podcasters. This platform will then distribute the episode to Spotify, Apple Podcasts, Google Podcasts, and others automatically. Keep in mind that you won’t have access to the links until the episode goes live, which occurs at 5 or 7 p.m. Berlin time on Friday.

Once it is published, you will receive the links to Spotify and Apple Podcasts. At that point, it’s crucial to fill out the corresponding form and perform the GitHub task to create a page for the episode. 

I recommend discussing the pre-filling process with Valeria, as she might have insights to make it more efficient. After you agree on the best approach, we should document everything thoroughly. As you familiarize yourself with the process documents, it may be beneficial to keep notes on what you’ve learned for future reference, including potential updates to the onboarding document. 

Eventually, we will review the processes document by document to ensure everything remains relevant and up to date. We’ll conduct this review soon."
audio_97@05-08-2024_17-52-17.ogg,97,2024-08-05 17:52:17,That's awesome. Can you please put this all to the onboarding document?,,
audio_98@05-08-2024_17-55-15.ogg,98,2024-08-05 17:55:15,And in general all the things you learn it would be nice to put there so they are not lost,Knowledge Preservation,"It's essential to capture and document everything you learn. By doing so, you ensure that this valuable information is not lost over time.

Organizing your knowledge in a structured way can also enhance your ability to recall and apply it in the future. Consider creating a digital repository or a personal journal to keep these insights accessible.

Sharing your knowledge with others can further reinforce your understanding and contribute to collective learning. Engaging in discussions or mentoring can provide fresh perspectives and help solidify what you've learned."
"audio_99@06-08-2024_11-40-10.ogg,audio_100@06-08-2024_11-40-47.ogg,audio_101@06-08-2024_11-41-16.ogg,audio_102@06-08-2024_11-41-41.ogg,audio_103@06-08-2024_11-42-09.ogg","99,100,101,102,103",2024-08-06 11:40:10,"So I want the process documents to be complete, in a sense that everything is there, like you don't need to copy text from, the text is already there, you don't need to type it yourself from pictures, you can just copy paste it from the actual process document, so you also need to include the emoji, and I want to do this for all the process documents, so then, like they are complete, the messages are copy-pastable, when we need a template we use a template, so then you don't really need to think much when you follow a process document, so that's the goal, and we should try to work on our process documents so they are like that. Another thing we should improve is, so right now all our process documents focus on how to do something, not about why and when, right? I think I already mentioned that. So let's, for this document, what we should write is this. So first, we want to understand why we need to do this. So why is our community members want to have access to the Slack data so they can do some analytics, et cetera, right? So this is why. And that is why we do monthly data dumps so they can have access to the fresh data from Slack. Then another thing is when to do this, so you do this every month when there is a reminder and this is exactly how you create it, right? So for this one and for others I want to have context so then it's clear why this document exists, why this process exists, why we should do this, not just how. And also what I just said about that process documents should be complete and that the process documents should explain why, not just what, why and when. Please add this to onboarding document too, so then I don't need to say it again, right, so it's just documented there.",Improving Process Documents,"I want our process documents to be complete. This means that all necessary text should be included within the document itself, eliminating the need to copy text from pictures or external sources. Users should be able to copy and paste from the actual process document effortlessly. Additionally, please ensure to include emojis where appropriate. I aim to apply this to all our process documents so that they are fully comprehensive, making it easy to follow without much thought when using them as templates.

Another area for improvement is the focus of our process documents. Currently, they primarily emphasize how to perform tasks, but we need to also address why and when certain actions should be taken. For instance, we must clarify why our community members need access to Slack data for analytics purposes. That is the rationale behind our monthly data dumps, which provide them with fresh data.

Furthermore, it is crucial to specify when these tasks should be performed, such as completing the data dumps every month when reminders are sent out. I want to ensure that each document provides context, helping users understand why the document exists, why the process is necessary, and not just how to execute it.

Lastly, please remember to incorporate these guidelines into the onboarding document. This will serve to document these expectations clearly, so I won’t have to reiterate them in the future."
audio_104@06-08-2024_11-43-24.ogg,104,2024-08-06 11:43:24,So I don't do to-do for this one. I don't know if you want me to do to edit to-do or maybe you want to manage it yourself like because probably right now you're busy with something else but I want to make sure that things I say don't slip through the cracks. For example with the dump I think I asked you to do it earlier and then I had to remind to do this again so I'd rather not do this and trust you that you don't need reminders and for that we need to think about right now it's okay it's not a problem I know you're overwhelmed and there are a lot of things you need to do and learn but we need to think about a way where I don't need to remind you about things because like I also for me it's hard to keep track of everything so perhaps when you hear to do you can do edit to do to the to-do list yourself or I know we can think about another way so let me know what you think about that,Management of Tasks and Reminders,"I wanted to discuss how we can manage our to-do items more effectively. I’m uncertain whether you’d prefer me to edit the to-do list or manage it yourself, especially since I know you’re busy with other tasks right now. However, I want to ensure that important points don’t slip through the cracks.

For instance, I had previously asked you to handle the task regarding the dump, but I needed to remind you about it again. To avoid this in the future, I’d like to find a system that works for both of us, so you won’t feel the need to rely on reminders.

I understand you have a lot on your plate and are overwhelmed at the moment, which makes it even harder to keep track of multiple tasks. Perhaps you could take ownership of the to-do list and make edits as you see fit. Alternatively, we can brainstorm other methods that might work better for us. Let me know your thoughts on this."
audio_105@06-08-2024_12-01-20.ogg,105,2024-08-06 12:01:20,"Yeah, that's right try to use something very close to what I said",,
audio_106@06-08-2024_12-10-34.ogg,106,2024-08-06 12:10:34,"One of the things you can do is download the voice messages that I sent. I don't know if you can do this from the mobile app, but you probably don't need to do it from the mobile app. So you open the desktop version, and there's an option to download the files. And then you can transcribe these files. I'll tell you how. I'm from mobile right now, so you'll need to adapt it to desktop, but I'll record something. And then you will need to create a process document for transcribing audio files. And then later, when you have the transcription, you can ask ChatGPT to summarize the transcription.",How to Download and Transcribe Voice Messages,"One of the things you can do is download the voice messages I sent. I'm not sure if this can be done from the mobile app, but it's likely unnecessary to do it that way.

To download the files, open the desktop version of the application. There should be an option to download the audio files directly. 

Once you have downloaded the files, you can transcribe them. Although I am currently using a mobile device, you will need to adapt the process for desktop use. I will record a demonstration, which will require you to create a process document specifically for transcribing audio files.

After you complete the transcription, you can use ChatGPT to summarize the content effectively."
audio_107@06-08-2024_12-11-58.ogg,107,2024-08-06 12:11:58,"Jā, tas ir ļoti kļūti treneris. Vēlētos vēlētos vēlētos.",,
"audio_108@06-08-2024_13-50-27.ogg,audio_109@06-08-2024_13-51-11.ogg,audio_110@06-08-2024_13-51-23.ogg","108,109,110",2024-08-06 13:50:27,"I think I mentioned it in one of the voice notes or maybe in loom I don't remember but yeah so Maybe I did not I just thought I did it's not a problem, but thanks for doing that Um, that is a bit too formal to my taste. We can simplify it. I am talking about the context you wrote. So maybe let's first split it into why and when, like exactly like I told you in the voice note.",Context Clarification,"I believe I mentioned this in one of the voice notes or perhaps in Loom, though I can't be certain. Regardless, I appreciate your efforts. However, I find the tone a bit too formal for my liking, so we can simplify it.

Specifically, I'm referring to the context you provided. It would be helpful to split it into two sections: the ""why"" and the ""when,"" just as I suggested in the voice note."
audio_111@06-08-2024_13-52-46.ogg,111,2024-08-06 13:52:46,This is just for me so I can easily read it and record the voice note at the same time.,Voice Note Preparation,"This note serves as a personal reference to facilitate easy reading while I record the voice note. 

It's crucial to maintain clarity throughout the recording process. This will ensure that the message is communicated effectively and understood by the audience. 

Additionally, I'll focus on structuring the content in a way that flows logically from one point to the next. This will help keep listeners engaged and enhance the overall quality of the voice note. 

Lastly, I aim to be concise, avoiding unnecessary filler while still conveying all essential information. This approach will make the voice note more impactful and easier to follow."
audio_112@06-08-2024_13-54-44.ogg,112,2024-08-06 13:54:44,"So, first of all, it's not context. Let's split it into two parts. Why and when. Then, when it comes to the text, the Slack data dump process is performed monthly to provide community... This is too formal. What exactly did I say there? Can you please check and use these words? Like, we don't want to be too formal. It's okay to use just common speech. Common language. Then, Slack data dump process is performed monthly to provide community members with up-to-date Slack data. Okay. I don't think I said for analytics and insights, I did not say that. This ensures that data remains fresh and relevant, supporting effective decision making and analysis. I don't think I said that either. The process is triggered by a monthly reminder, highlighting the importance of maintaining... Like, highlighting the importance, I don't think I said that to you. Could you please try to stick to what I said? And, like, to me, maybe for you it will take some time to understand what we should include there, what we should not. It's okay. It will take time. But, like, I want each word to make sense. Right? And, like, for me, highlighting the importance of maintaining accurate and timely data access, it does not convey... It does not have any useful information there. Right? So, let's try to include only things that are needed and not repeated. Because we... In this part, we repeated quite a lot. Right? So, please, listen to what exactly I said and use that. And then with time, you will be able to write it yourself using the language I want to use.",Slack Data Dump Process Overview,"First, let's break this down into two parts: why and when. The Slack data dump process happens monthly to give community members access to the latest Slack data. 

It's important to keep this data fresh and relevant for effective decision-making. The process is triggered by a monthly reminder, ensuring the community stays updated with accurate, timely information. 

Moving forward, I want to focus on being clear and concise. Please make sure to use simple, common language and avoid overcomplicating things with formal phrases. It's essential for each word to make sense and serve a purpose. 

As we refine this process, we'll work on including only the necessary information and avoiding repetition. With time, I believe you will adapt to the style I want."
audio_113@06-08-2024_13-56-05.ogg,113,2024-08-06 13:56:05,"So I took a look at the entire document, it looks fine, please don't use BOLD there, like I don't understand what it means, so we don't really need to use BOLD for formatting, and apart from that, looks okay.",Review of Document Formatting,"I reviewed the entire document, and overall, it looks fine. 

However, I would prefer if you refrain from using bold text. I don't understand its purpose in this context, and I don’t think it is necessary for formatting. 

Aside from that, everything else appears to be okay."
audio_114@06-08-2024_14-17-37.ogg,114,2024-08-06 14:17:37,"I quite often send voice notes, so maybe what I just showed you will be useful. And also, like, when I say something in the voice note, typically I want, like, let's say with this why and when, I want not to deviate too much from that. So ideally, when you have a transcript for you, it's actually easier to use the language I use. And also, again, you can use ChargeBT to make it more structured. Because when I say in voice note, it might be not as structured when we just transcribe it and put it to the document. So use ChargeBT to make it more structured.",Voice Note Transcription Tips,"I often send voice notes, so I hope what I’ve shared will be useful for you. When I provide information in a voice note, I typically want to stay focused on the key points, such as the ""why"" and ""when."" It’s important to avoid straying from these main ideas.

Having a transcript can make it easier to utilize the language I use in my voice notes. This can help ensure that the essence and intent of my message are preserved.

Additionally, I recommend using ChargeBT to enhance the structure of the transcript. Voice notes may not have a completely structured format when they are transcribed, but ChargeBT can help organize the content more effectively in the document."
"audio_115@10-08-2024_15-21-38.ogg,audio_116@10-08-2024_15-22-07.ogg","115,116",2024-08-10 15:21:38,"So Luma is for people, for registering on events. So first we create a Luma event, and then it doesn't matter if we create a next one on Meetup. So Meetup is also a platform where people can discover events and sign up for them. So we use Luma and Meetup. Before it was Eventbrite and Meetup, and now it's Luma and Meetup, we don't use Eventbrite anymore. And then for the calendar, yeah, we create a calendar event. And sometimes people don't want to sign up for individual events, they just want to see, to have all events in the calendar, right? So they don't need to sign up for anything. And for them, we maintain a calendar. So that's why. And in the calendar, in case they actually do want to sign up, we want to include the Luma link so they can discover it, right? That's the idea. Again, summary. First you create a Luma event, and then it can be just a calendar or Meetup. And then for calendar, what I would call it is not just calendar, but let's say DataTax Club events calendar. So then it's more clear what exactly it means, what kind of calendar it is, right? Because calendar can mean many things. And also maybe that's why I have a confusion, because there are not three calendar events, right? It's just one, right? Okay, so I hope it clarifies it. As for Eventbrite process documents, when we move them to the new shared drive, let's just not move them. Let's just ignore everything that is related to Eventbrite. We don't move them. They can stay in the old Google folder.",Event Management with Luma and Meetup,"Luma is primarily designed for registering participants for events. Initially, we create events on Luma, and we can create additional events on Meetup as well. Meetup serves as another platform where people can discover and sign up for events. Currently, we use Luma and Meetup for our events, having phased out Eventbrite.

In terms of calendars, we also maintain a centralized events calendar. Some people prefer not to register for individual events; they simply want to view all upcoming events in one place. Therefore, we keep a calendar to accommodate those needs. If individuals do wish to sign up for an event, we include a link to the Luma event in the calendar to facilitate the sign-up process.

To enhance clarity, we should refer to the calendar as the ""DataTax Club Events Calendar."" This title specifies the purpose and content of the calendar more clearly, as the term ""calendar"" can be ambiguous.

Regarding the Eventbrite process documents, it's best to leave them untouched when transitioning to the new shared drive. We should disregard anything related to Eventbrite and allow those documents to remain in the old Google folder."
"audio_117@10-08-2024_15-23-29.ogg,audio_118@10-08-2024_15-23-45.ogg","117,118",2024-08-10 15:23:29,"Sorry, I did not see that. So sometimes when people do not respond with bio, we take a genetic bio. There should be a process document for that. Maybe you can try to find it. But the idea is we just simply take whatever is on their LinkedIn and use that as a bio. We can probably refine it a little bit. We can try to use chatGPT for creating a bio based on their LinkedIn profile, for example. Right now, we just take whatever they already wrote in LinkedIn if they don't respond. So please check it, try to find this document. And yeah, sorry I was not, I didn't reply to your messages because I just missed them. So if it happens, I would appreciate if you just remind me.",Bio Creation Process,"Sometimes, when individuals do not respond with their bios, we utilize a generic bio instead. There should be a process document outlining this procedure, so please try to locate it. Essentially, we take whatever information is available on their LinkedIn profile and use that as a bio. 

We can refine it slightly, and we might even consider using ChatGPT to create a bio based on their LinkedIn profile. For now, if someone does not respond, we will simply use the information they have already provided on LinkedIn.

Lastly, I apologize for not replying to your messages; I simply missed them. In the future, I would appreciate it if you could remind me when that happens."
audio_119@10-08-2024_15-24-47.ogg,119,2024-08-10 15:24:47,"So this one, you get this to do when Dave uploads an edited podcast episode to our Dropbox. So when it happens, you'll get an notification and you need to upload it to Spotify for podcasters and do the rest of the things.",Podcast Episode Upload Procedure,"When Dave uploads an edited podcast episode to our Dropbox, you will receive a notification. Your task will be to upload the episode to Spotify for Podcasters. 

After uploading, please complete any additional required actions related to the podcast episode."
