filename,number,datetime,text,title,edited
audio_51@19-04-2024_11-19-02.ogg,51,2024-04-19 11:19:02,"So maybe I can share a tip with you So when I watched a video and then I want to make sure I don't forget anything from that video I don't know if this is useful for you. But this is how I do this personally. So I have a piece of paper and when I go through the video there is a like I Take notes of what I need to do from that video or what I want to remember what I want to put in some notes So maybe you can do something like that, so then you don't forget so you watch the video you take notes Right, and then you come back to those notes and this way you will not forget that I asked something, right? So then you will remember. Uh-huh, like you asked not to create a process document, but just give the context and link the long video just for example or Something else right. So sometimes I know that in one video I can ask you like three four or five things and It's very easy to forget to do one or two of them, right and if you do it this way, then Probably the chances that you will do this are lower, right? So this is just advice. Maybe you will find something else that works, but we just need to make sure that We don't forget things right so like I want to tell you something I want this to happen If it doesn't and I have to recheck What do you do? Like yeah, then I lose time you lose time then we're doing this and yeah, it's kind of not fun Okay, and thanks again for your work",Note-Taking Strategy for Retaining Video Content,"I’d like to share a tip for remembering important information from videos. After watching a video, I find it helpful to take notes on a piece of paper. This helps me capture what I need to remember or any action items that arise from the video.

After taking notes, I make it a point to revisit them. This practice ensures that I don’t forget important details or questions I might have, which can easily slip my mind if I’m not careful. For example, instead of creating a process document, you might consider simply providing context and linking the longer video content.

I often find that in one video, I can think of three to five different questions or action items. It’s easy to overlook one or two of them without a clear system in place. By following this note-taking method, you can reduce the chances of forgetting what needs to be done.

It's crucial for us to keep track of these details so that we can avoid wasting time and ensure everything runs smoothly. Thank you again for your work on this!"
audio_52@02-05-2024_14-37-25.ogg,52,2024-05-02 14:37:25,"So, let's plan a pre-launch Q&A for next Tuesday at 4.30 p.m. Central European time, Berlin time, for the ML Ops course. Please coordinate with Valeria about the content.",Pre-Launch Q&A Planning for ML Ops Course,"Let's plan a pre-launch Q&A for next Tuesday at 4:30 p.m. Central European Time, which corresponds to Berlin time.

Please coordinate with Valeria regarding the content of the discussion."
audio_53@06-05-2024_18-36-26.ogg,53,2024-05-06 18:36:26,yeah my idea with this document where we put like if there is a mistake we put the mistake and how to address it so my uh thinking is if we do that then it becomes clear in which things there are more mistakes than in others and maybe there are some areas to which we can pay more attention but also for you you kind of will remember okay like it looks like i made a mistake previously in this process so maybe next time i'll pay more attention to that one so that's my thinking i hope it will help but also like if you have any other ideas how we can make sure that it doesn't happen again it would be good because i understand that you might be quite overwhelmed with the information that you need to process so we just need to think of ways how to make it easier for you or make it more difficult for you to make a mistake right and learn like sometimes they happen this fine this is this always happens in our life but like how we can make sure that we avoid repeating them in the future so for now we can just start collecting this in a document and then see maybe something comes up but if you have some other ideas uh yeah please let me know,Mistake Tracking and Improvement Strategy,"My idea for this document is to identify mistakes and suggest how to address them. By doing this, we can clearly see which areas have more frequent errors and where we may need to focus our efforts. This will also serve as a reminder for you; if you notice a pattern, you may be more likely to pay closer attention the next time.

I hope this approach will be helpful, but I’m open to any other suggestions you might have for preventing these mistakes in the future. I understand that you may feel overwhelmed by the volume of information you need to process. Therefore, it’s important to find ways to make this easier for you or to reduce the likelihood of errors occurring.

Mistakes are a part of life, and while they can happen, we need to consider how to avoid repeating them. For now, let's begin by collecting this information in a document and see what insights arise. If you have any additional ideas, please share them with me."
"audio_54@21-05-2024_08-41-54.ogg,audio_55@21-05-2024_08-42-09.ogg","54,55",2024-05-21 08:41:54,"Remember, I recently asked you to upload a video from Antonis, so please use that video for the URL in the Luma Project of the Week event. Ir pasirinkite jį į e-mailį. Jūs pasirinkite e-mailį su mūsų, pasirinkite jį ir pasirinkite e-mailį su mūsų. Ir mes išsidėsime mažai. Įmušimas yra šiandien, taigi pasirinkime jį šiandien.",Luma Project of the Week Video Upload,"I recently asked you to upload a video from Antonis, so please use that video for the URL in the Luma Project of the Week event. 

Next, select the email option. Choose the email with our details and arrange it accordingly. 

Just a reminder, the submission deadline is today, so let's make sure to finalize everything today."
audio_56@21-05-2024_19-33-48.ogg,56,2024-05-21 19:33:48,"Hi everyone! Welcome to day and number of the day of Project of the Week Data Version Control. We're starting soon and the plan for the day you can see in Slack and then you can also add the link to Slack. This is what you... this was the link that we used in the event. So you can write, you can join the Project of the Week channel using this link. And then to learn more about Project of the Week check this video. This is what Antonis created. So... and then add and have fun. So send me this for checking and then just do it for all the days. Then we should save it in the process document or in the templates, whatever.",Project of the Week: Data Version Control - Day Overview,"Hi everyone! Welcome to Day [insert day number] of Project of the Week: Data Version Control. We're about to get started, and you can find the day's agenda in Slack. 

Please use the link provided in the event to join the Project of the Week channel. For further information about Project of the Week, check out the video created by Antonis. 

Have fun and send me your notes for review. Once you've done that, please replicate the process for all the days. Finally, we should save everything in either the process document or the templates folder."
audio_57@04-06-2024_09-37-48.ogg,57,2024-06-04 09:37:48,And maybe ask them if they know and if they can put us in touch with a marketing person because we see that they are Promoting their product and we also want to help so we'll appreciate if they put us in touch something like that And please send me this before sending,Connecting with Marketing for Collaboration,"We should reach out and ask if they can connect us with someone from their marketing team. Since they are actively promoting their product, we would like to explore opportunities for collaboration to help them further. It would be great if they could facilitate this introduction.

Please send me this message before sending it out."
audio_58@06-06-2024_16-12-54.ogg,58,2024-06-06 16:12:54,"I don't know if we already have a process document for that, but maybe create a process document where you show how to check the merchant account to see if there is any income and include the link to that to the current process document where you show how to check the merchant. So just as a part of the process document, say like step whatever, check the merchant account and link the new process document.",Creating a Process Document for Merchant Account Income Verification,"I am not sure if we already have a process document for checking the merchant account, but I suggest we create one. This document should outline how to verify if there is any income from the merchant account.

Additionally, it would be helpful to include a link to this new document within the existing process document that explains how to check the merchant account. 

As part of the new process document, we can specify a step, like ""Step X: Check the merchant account,"" and provide the link to the relevant materials for easy reference."
audio_59@06-06-2024_17-56-00.ogg,59,2024-06-06 17:56:00,"By the way, the workshop for Akella is sponsored by DLT Hub, so get the logo from the previous one, the one that Adrian did, and also put it on the cover.",Akella Workshop Sponsorship,The upcoming workshop for Akella is sponsored by DLT Hub. Please ensure that you obtain the logo from the previous workshop conducted by Adrian and include it on the cover.
audio_60@07-06-2024_07-33-56.ogg,60,2024-06-07 07:33:56,"So first thing is when I send a screenshot from some clients, then it means that we received the money So please write to them acknowledge the received as soon as possible and second when I sent you a screenshot with Money that some service took from us Usually the payment amount the original payment amount was in dollars But then I sent you the amount in euros, so then we have accurate information in our Spreadsheet. So please create a process document for that and Describe what to do when I send a screenshot With some payment either received or spent",Payment Acknowledgment and Process Documentation,"The first thing to note is when I send a screenshot from a client, it means we have received the payment. Please write to them to acknowledge the receipt as soon as possible. 

Secondly, when I send you a screenshot showing money that a service has charged us, note that the original payment amount is usually in dollars. However, I will provide you with the equivalent amount in euros so we can maintain accurate information in our spreadsheet.

Please create a process document outlining the steps to follow when I send a screenshot of a payment, whether received or spent."
"audio_61@07-06-2024_17-44-49.ogg,audio_62@07-06-2024_17-45-22.ogg","61,62",2024-06-07 17:44:49,"It's better to say that the last month we accidentally sent you a wrong invoice. The reason was that we, when sending an invoice to this tag, we forgot to add VAT. So then we added VAT and now we have the updated invoice. So something like that. Because from what you wrote, it's not clear. Well, they will have to guess many things. And yeah, please make sure that the invoice is not just for VAT, but that this is the sum for the newsletter promotion plus VAT. So it should be like 1,500 plus 18 percent, something like that. So the invoice should contain the whole thing. Okay.",Invoice Correction and Clarification,"Last month, we accidentally sent you an incorrect invoice. The issue arose because we forgot to include VAT when we initially sent it to you. We have now updated the invoice to include the VAT.

To clarify, the invoice should reflect not just the VAT amount, but also the total for the newsletter promotion. The final amount should be presented as 1,500 plus 18 percent VAT, detailing the complete sum.

Please ensure that the revised invoice contains all necessary information, so there is no confusion moving forward."
audio_63@07-06-2024_17-47-47.ogg,63,2024-06-07 17:47:47,I think we should be as detailed as possible so it's very important so please describe you say that in this month we sent an invoice without VAT they paid then we realized we forgot to add a VAT we sent another invoice and then they paid only the VAT that's why last month we sent you this invoice and this is a wrong invoice you should not include it when you submit the tax declaration or maybe you don't say that you say like please disregard that invoice this is the rated invoice please use that and you can say when they paid the original sum and when they paid the VAT right and I think this is important so let's be as detailed as possible and show me that one more time before sending it to them,Invoice Clarification,"It's important that we provide as much detail as possible regarding the recent invoicing issues. This month, we sent an invoice without VAT, which the client paid. After realizing that we had forgotten to include VAT, we issued a second invoice for the VAT amount alone. 

As a result, last month, we also sent you an invoice that was incorrect. You should not include this incorrect invoice when submitting your tax declaration. Instead, please disregard that invoice. 

The correct invoice should be highlighted and used for submission. Additionally, please include the dates when the original amount was paid and when the VAT was settled. It's crucial to be thorough in this matter. 

Before sending anything to the client, please show me the details one more time. Thank you."
audio_64@07-06-2024_17-52-58.ogg,64,2024-06-07 17:52:58,"Yeah, I think it's okay if in the table, in our bookkeeping spreadsheet, we have the first invoice on the first payment and then the second payment. So first just $1,500 and then the VAT. Because it better reflects that there were two payments, right? And then we just explain. Well, I already told you.",Payment Structure in Bookkeeping,"I think it's acceptable to structure our bookkeeping spreadsheet to show the first invoice as the initial payment, followed by the second payment. We should list the first payment as $1,500, with the subsequent addition of VAT. This approach provides a clearer representation of the two distinct payments.

Additionally, as I mentioned earlier, we can provide an explanation for this structure to ensure clarity."
audio_65@10-06-2024_15-05-03.ogg,65,2024-06-10 15:05:03,"Do we use the CRM for tracking payments? I just saw the email from Elisabetta from DoubleCloud and maybe we don't. Remember, we created this CRM in order to remember about things that weren't paid. So it's great if we use it and keep track of paid invoices and invoices we haven't created and so on.",Tracking Payments with CRM,"Are we using the CRM to track payments? I just saw an email from Elisabetta at DoubleCloud, and it seems we might not be using it for this purpose. Remember, we initially created the CRM to help us keep track of outstanding payments. 

It would be beneficial to utilize the CRM effectively by monitoring both paid invoices and those we haven't generated yet. This way, we can ensure we stay on top of our financial obligations."
audio_66@12-06-2024_20-23-12.ogg,66,2024-06-12 20:23:12,"So the other file is actually a tool that I wrote that allows to use this ffmpeg And you don't need to install or anything. You can just use it for Cutting and cutting videos and increasing volumes Volume, I have no idea why it doesn't work Yeah, we will figure it out",Video Editing Tool Using FFmpeg,"The other file is a tool that I created, which allows you to use FFmpeg without the need for installation. 

This tool can be used for cutting videos and increasing volume levels. 

I'm not sure why it's not working at the moment, but we will figure it out."
audio_67@14-06-2024_20-00-02.ogg,67,2024-06-14 20:00:02,So it should be Right there that it's six newsletters so call it a Sponsorship then in the same line write six newsletter issues and a logo on the website and The cost is the same so it should it should be like that because we sell them six newsletter issues And the logo on the website,Sponsorship Details,"We have a sponsorship opportunity that includes six newsletter issues. In addition, the sponsorship will feature a logo on our website. 

The cost for this sponsorship remains consistent, as it covers both the six newsletter issues and the logo placement."
audio_68@02-07-2024_15-30-40.ogg,68,2024-07-02 15:30:40,"I just noticed that Arise has used all their promotion slots So maybe we should ping them and ask if they want to reserve anything else, so please Write an email to first send the email to me to David And ask him if they want to book more Yeah",Promotion Slots Inquiry,"I just noticed that Arise has utilized all their promotion slots. We should reach out to them to see if they would like to reserve any additional slots.

Please draft an email to send to David first, asking if they are interested in booking more promotions."
audio_69@02-07-2024_16-02-54.ogg,69,2024-07-02 16:02:54,"So a small comment about that. We don't want to be, to look too available. So this way they will, they can use it as leverage next time we negotiate deals. They see that we have too many open slots and next time they can say, oh, we will not pay that much, right? So please don't send this in the future. Maybe it's better to select just one slot every week, every month and then send it to them so that we don't look too free, too available. Please create some sort of process document for that. When, what to do when people ask for slots and then describe different situations, like what to do when we are almost fully booked and when we are not booked fully like now, okay? And then send me this document for checking.",Managing Availability in Negotiations,"I have a small comment regarding our availability for negotiations. It's important that we don't appear too available, as this could be used as leverage by the other party in future discussions. If they notice that we have too many open slots, they might feel entitled to negotiate lower prices.

To mitigate this, I recommend that we only send one available slot each week or month instead of multiple options. This approach will help us maintain a perception of limited availability.

Additionally, please create a process document outlining our approach to handling slot requests. Include guidance for different scenarios, such as when we are almost fully booked versus when we currently have a lot of availability, like now. Once you've drafted the document, please send it to me for review."
audio_70@04-07-2024_17-12-53.ogg,70,2024-07-04 17:12:53,so you see how much the line is like for taxes it's quite a lot so usually that one was so usually the price is lower right so that one was for the tax declaration from the last year I think yeah 2023 and I think I already made a comment that we should name it differently maybe I did not I don't remember I think I remember doing something like that mentioning that it's not correct and we for some reasons have two records with the same amount which is not right so we have monthly payment which goes at the end of the at the beginning of the month but that one was like not exceptional but like yeah irregular let's say and I think you did it on your own remember I sent you an email and you're supposed to pay but instead you just put it to the spreadsheet maybe that's why I don't know but yeah please check it out check it like if we I don't think we have we made two payments so it was one payment and there the it should be not may whatever but like just 2023 because it was a declaration for the entire year not usual bookkeeping,Clarifying Tax Records,"The amount listed for taxes appears to be quite significant. Usually, we expect the price to be lower. The recent figure pertains to the tax declaration for the last year, specifically for 2023. 

I believe I previously suggested that we should rename this entry, although I’m not certain if I actually communicated that or just thought about it. Additionally, it seems we have two records with the same amount, which may not be accurate. 

As a reminder, we have a monthly payment that occurs at the beginning of each month. However, this particular entry is irregular rather than exceptional. I think you might have handled this independently. I recall sending you an email regarding the payment, and rather than completing the payment as instructed, it seems you entered it into the spreadsheet instead. 

Please double-check this information. I don’t think we made two payments for the tax declaration — it should reflect only one payment. The entry should be marked simply as “2023,” since it pertains to the entire year's declaration rather than standard bookkeeping."
audio_71@08-07-2024_09-17-26.ogg,71,2024-07-08 09:17:26,"Our lawyer just told me that we don't have the right cover for the recent webinar, that we have a podcast cover. So this is one of the other things we should pay attention to. Please add it to the document with things to look out for, okay?",Webinar Cover Update,"Our lawyer just informed me that we currently do not have the appropriate cover for the recent webinar; instead, we only have a podcast cover. 

This is something we need to pay attention to moving forward. 

Please ensure this is added to the document outlining things we need to look out for. Thank you."
audio_72@08-07-2024_19-36-05.ogg,72,2024-07-08 19:36:05,"I moved the events with Rafael to next Thursday Just in case we don't forget to so that we don't forget to To move it. So once we decide on the exact date, we will update one more time The reason I did that is if we forget then tomorrow everyone who signed up will get a reminder and this is we Something we'll want to avoid definitely and in general like if it's a short notice like The event is tomorrow and today we cancel just move it one week ahead to any random day because we don't want accidentally end up in a station when People get notification that event starts they go there. They join but there is nothing right? I don't know if we have an a process document for that. If we don't please create and send it to me",Event Rescheduling Protocol,"I moved the events with Rafael to next Thursday to ensure we don't forget to reschedule. Once we decide on the exact date, we will provide one more update.

The reason for this change is to prevent any confusion. If we forget and the event is scheduled for tomorrow, everyone who signed up will receive a reminder, which is something we definitely want to avoid.

Additionally, if it's a short notice like an event scheduled for tomorrow and we need to cancel today, we should reschedule it for a week later on any random day. This is essential to prevent situations where people arrive for an event only to find it canceled.

I’m not sure if we have a process document for this. If we don’t, please create one and send it to me."
audio_73@29-07-2024_16-28-39.ogg,73,2024-07-29 16:28:39,"Yeah, sometimes I will be recording voice messages, sometimes I'll be recording Loom videos. So with these Loom videos I record something usually and then I ask you to either do it or document it in a process document. So right now what you can do is go through the process documents that we have, at least just briefly understand what is there. And then for the to-do items, for the items that we did in the past, that are completed already, try to find what is the process document that is needed to complete this task. I will help you with that, but for now maybe try to find it out yourself. And then I'll take a look at what you found and say that okay, this is the right document or this is not the right document. And then also, yeah, you'll need to create a GitHub account and then there are some items in the to-do list, you can also check them out, but yeah, you'll need to know how to do them and for that you'll need to review process documents.",Managing Tasks and Documentation,"I sometimes record voice messages and create Loom videos. In these Loom videos, I usually demonstrate a task and then ask you to either replicate it or document it in a process document.

Right now, please take some time to review the existing process documents. It's important to get a brief understanding of what's available. For the completed tasks we've worked on previously, try to identify the corresponding process documents needed for those tasks. I’ll assist you with this, but for now, please attempt to find the right documents on your own. Once you've done that, I can review your selections and confirm whether they are correct.

Additionally, you will need to create a GitHub account. There are several items in the to-do list that you'll need to familiarize yourself with, and reviewing the process documents will be crucial for understanding how to complete these tasks."
