filename,number,datetime,text,title,edited
audio_145@15-08-2024_16-04-52.ogg,145,2024-08-15 16:04:52,"Also, don't forget to update Meetup and the Google Calendar, the community Google Calendar.",Update on Community Calendar,Please remember to update Meetup and the community Google Calendar. It's important to keep both platforms current to ensure everyone is informed about upcoming events. Thank you!
audio_146@15-08-2024_16-22-37.ogg,146,2024-08-15 16:22:37,"So you probably know, I just wanted to make sure I say it. So when I mean calendar invite, calendar event, so I mean the Data Talks Club community calendar, the Google calendar that is for the community members, but we also have calendar invites that we send for the guests and for me. So I have it on my calendar, right? So the one you just updated was the one for guests, and usually it is five minutes earlier than the actual thing. And then for the community calendar, this is at the time when it actually starts.",Calendar Invites Explained,"I want to clarify what I mean by calendar invites and events. When I refer to the calendar invite, I’m talking about the Data Talks Club community calendar, which is a Google calendar specifically for our community members. 

In addition to that, we also send calendar invites for guests and for myself. This allows me to keep all relevant events on my calendar. 

The recent update you made was for the guest invites, which are typically set five minutes earlier than the actual event. For our community calendar, the time listed reflects when the event truly starts."
audio_147@19-08-2024_07-02-53.ogg,147,2024-08-19 07:02:53,So usually as you saw Ella kinda I think she requested to move the podcast episode I am not sure but like probably so what we do in this case is when we have not agreed on a date yet but the event is happening today what we do as soon as possible is just move to some random date in the future in Luma and meetup and calendar so people don't have it on their calendars so they know it's not happening while we are agreeing on a new date it's also important to move it as soon as possible so people don't receive notifications because otherwise they would receive a notification saying that event is starting like in 15 minutes so they join and they don't see anything so that's frustrating and also on some platforms I think on meetup maybe on Luma too if we move if we don't move an event and it started then we cannot move it anymore we need to create a new one which is problematic because for that one people signed up for the new one they did not so we will need to ask them somehow to sign up again so that is why we need to when events are being scheduled on that day when it's happening and we need to find a new date this what I do just find some random date in the future and schedule all the on all the platforms this event to some random future date while we agree on the new date yeah I think we should create a process document for that if we don't have it where we describe it,Handling Last-Minute Podcast Rescheduling,"Ella requested to move the podcast episode, and in such cases where we haven't agreed on a new date yet, we typically take immediate action. Since the event is happening today, we will move it to a random future date in Luma and Meetup calendars. This ensures that people are aware the event is not happening as we work on confirming a new date.

It's crucial to make this change as soon as possible to prevent attendees from receiving notifications. If we don't act quickly, they might get a notification stating the event starts in 15 minutes, leading them to join only to find nothing occurring, which can be quite frustrating.

Additionally, on some platforms like Meetup and possibly Luma, if we fail to move the event before it begins, we can no longer edit it. We'll have to create a new event instead, which poses a challenge since people signed up for the original event but not for the new one. This would require us to ask them to sign up again, complicating the situation further.

Given these considerations, I recommend that we create a process document if one doesn't already exist, outlining the steps to handle last-minute rescheduling effectively."
audio_148@19-08-2024_09-22-22.ogg,148,2024-08-19 09:22:22,"I think I already told you how you should approach that. I'll just repeat it just in case. So, 9am Pacific Time Zone is 6pm Central European Time. So usually I try to avoid having things on that time. So what I can do, and usually if I need to do it somewhat late, like 5, 5.30, 6pm, I prefer to do this on Mondays. So Wednesday, Thursday, Friday are no go for that. So usually I am not available after 3pm my time. And if this is something after 5pm, this is for Open Source Spotlight, if this is something after 5pm, I only can do this on Mondays. And you can see my calendar on which Mondays I am free to do that. And what you can do is you can ask if they can do this on a 30-day time and suggest a time slot. And if they can't, ask on which Monday they can do 9am.",Scheduling Availability,"I wanted to clarify my availability for meetings. As a reminder, 9 AM Pacific Time corresponds to 6 PM Central European Time, which is generally a time I try to avoid for scheduling. 

If we need to hold a meeting later in the day, such as at 5, 5:30, or 6 PM, I prefer to do this on Mondays. Wednesdays, Thursdays, and Fridays are not suitable for me after 3 PM. 

Specifically for the Open Source Spotlight, I can only accommodate meetings after 5 PM on Mondays. You can check my calendar to see which Mondays I am available. 

If you need to propose a meeting time, consider asking if they can do this within a 30-day timeframe, and offer a specific time slot. If that doesn’t work, you can inquire about which Monday they would be able to meet at 9 AM."
audio_149@20-08-2024_10-44-41.ogg,149,2024-08-20 10:44:41,"So exactly when it's set for today, so when it's set for today, but the speaker bounces for whatever reasons We don't have time to agree to a future day right now We need to move the data up and then start agreeing because if we don't then we risk like all the things that I described in that voice message",Schedule Coordination,"The meeting is set for today, but the speaker cannot attend due to unforeseen circumstances. Unfortunately, we don't have time to agree on a future date right now. 

We need to prioritize moving the agenda forward and start making the necessary agreements. If we fail to do this, we risk encountering the issues I mentioned in my previous voice message."
audio_150@20-08-2024_11-21-52.ogg,150,2024-08-20 11:21:52,"I don't understand the question like how an invoice cannot be in Phenom if you create it in Phenom? So let's say you... I'll take an example. So right now we are talking with AirByte. Remember you sent an email to John the other day about the newsletter. So if a newsletter goes through, if they actually buy this, if they decide to sponsor us,",Invoice Clarification,"I'm a bit confused about how an invoice cannot be in Phenom if it was created there in the first place. 

To provide an example, let's consider our current discussions with AirByte. Do you remember the email you sent to John the other day regarding the newsletter? If the newsletter goes through and they decide to sponsor us, it will be important for us to track any associated invoices accurately in Phenom."
audio_151@20-08-2024_11-22-54.ogg,151,2024-08-20 11:22:54,"It was a bit noisy, so I... Okay, let me continue. So if they decide to sponsor us, what we do next is, well, we arrange everything for the newsletter, but at the same time, we start the, I guess we call it the invoice process or whatever. So we first get their information about, like, the company, name, address, and so on. And then we create an invoice in Phenom, and then we send them the invoice for payment. So this is how it works. So, like, that's why the question, like, creating an invoice when it's not yet in Phenom, doesn't make much sense, because, like, you create it in Phenom, and then it stays in Phenom. So if it's not in Phenom, you need to create it there, I guess. And this is the only place where we create invoices. And why did you ask that?",Sponsorship and Invoice Process,"It was a bit noisy, so let me continue. If they decide to sponsor us, the next step is to arrange everything for the newsletter. At the same time, we initiate the invoice process.

First, we collect the company’s information, such as name, address, and other relevant details. Then, we create an invoice in Phenom and send it to them for payment. This is how our process works.

Regarding your question about creating an invoice when it's not yet in Phenom, it doesn't make much sense to do that. Invoices should be created in Phenom because that's the only platform we use for this purpose. If it's not in Phenom, we need to create it there. 

Why did you ask that?"
"audio_152@20-08-2024_12-14-53.ogg,audio_153@20-08-2024_12-15-23.ogg,audio_154@20-08-2024_12-15-39.ogg","152,153,154",2024-08-20 12:14:53,"So invoices that we send to customers are in Finom, and yes, we need to put them to Dropbox. Invoices that we get, or receipts, we do not put them to Finom, if this is your question. So, typically we create invoices, we save invoices from FIDOM to Dropbox is when we prepare this report, monthly report. So then we just simply go through paid invoices. If an invoice is paid, then we put this to Dropbox and then send it to our accountants. Also, please make sure that everything I say is somehow captured somewhere. So, like, maybe in some sort of document, so this information is not lost.",Invoices Management and Documentation,"We send invoices to customers using Finom and store them in Dropbox. However, we do not upload invoices or receipts that we receive to Finom. 

Typically, we create invoices and save them from Finom to Dropbox when preparing our monthly report. We review the paid invoices, and once confirmed, we add them to Dropbox before sending them to our accountants. 

It's important to ensure that everything I mention is documented properly. This way, the information will be preserved and not lost."
audio_155@20-08-2024_12-27-57.ogg,155,2024-08-20 12:27:57,"So, when we pay for a product or a service, we get an invoice or a receipt. So, this is confirmation that we made the payment and this is what we use. This is what we need to send to accountants. So, this is a proof that we indeed paid the money. So, this is our expenses. So, I can call them incoming invoices or I don't know if it's the right name or not. And outcoming invoices is what we send to our clients. So, in my example, with AirByte, if they decide to sponsor our newsletter, then we send them an invoice. I usually just say invoice. But in this case, we send them an invoice. This is the invoice in the terminology I used. This is an outcoming invoice. It's coming from us to them and they have to pay for it. So, the flow is we send the invoice, then they pay.",Understanding Invoices and Receipts,"When we pay for a product or service, we receive an invoice or a receipt. This serves as confirmation of our payment, which we need to send to our accountants as proof of our expenses. 

Invoices can be categorized as incoming or outgoing. Incoming invoices are those we receive from vendors, while outgoing invoices are what we send to our clients. For example, if AirByte decides to sponsor our newsletter, we would send them an outgoing invoice. 

In this context, I typically refer to this document simply as an invoice. However, it's important to clarify that in this situation, it is an outgoing invoice—one that we issue to the client, who is then required to make a payment. The process is straightforward: we send the invoice, and they subsequently pay."
audio_156@20-08-2024_12-29-31.ogg,156,2024-08-20 12:29:31,"And, for example, for invoices that we receive, there are two kinds of invoices, or not kinds, but sometimes we get an invoice and then we have to pay for the invoice. That's the first sort. And the second one is when we already paid, let's say, using a bank card or something like this, like in case with OpenAI, this is the case. We first pay, and then as a proof of payment, we get the invoice, or sometimes there is a receipt. And usually, like when we have both invoice and receipt, we're interested in the receipt. So for example, in case of OpenAI, we usually have a receipt, so we don't need the invoice. And for example, ProSilo is also, we get a receipt in many services, we have a receipt. So this receipt is just as a proof of payment, it's enough. But sometimes we get just an invoice, no receipt, and it's also fine. And in cases when we first get an invoice, then we need to pay for this invoice. And only then, once we paid, we declare this invoice, we put it to the bookkeeping spreadsheet and Dropbox folder.",Invoice Payment Processes,"When it comes to invoices, there are two main scenarios we encounter. The first scenario is when we receive an invoice that requires payment. In this case, we need to process the payment before we can document it.

The second scenario occurs when we have already made a payment using a bank card or a similar method. An example of this is our dealings with OpenAI, where we first pay for the services and then receive an invoice or receipt as proof of that payment. In these instances, we usually find it more useful to keep the receipt rather than the invoice.

Similarly, with services like ProSilo, we often receive a receipt as proof of payment. A receipt suffices for our records, and we sometimes do not require an invoice at all.

There are also occasions when we only receive an invoice without a corresponding receipt. In such cases, everything is still manageable. For invoices that we receive first, we must pay them, and once payment is completed, we then document the invoice in our bookkeeping spreadsheet and store it in the appropriate Dropbox folder."
audio_157@20-08-2024_12-39-05.ogg,157,2024-08-20 12:39:05,"There should be a process document for creating events. So you, from your calendar, create an event and add me as a guest. And also make sure that I can modify the events. There is a process document, please find it. It seems that you changed the lunch event to the podcast document. This is not how you should do this. So please find the process document for that. And redo this podcast calendar invite with Andrea using this process document.",Event Creation Process,"There should be a process document for creating events. To create an event from your calendar, please add me as a guest and ensure that I have permission to modify the events.

It appears that the lunch event was mistakenly changed to the podcast document. This is not the correct approach. Please refer to the process document for guidance.

Additionally, I would like you to redo the podcast calendar invite with Andrea, utilizing the process document."
audio_158@20-08-2024_12-40-54.ogg,158,2024-08-20 12:40:54,"So I want to ask you for a favor, when you want to do something please first try to find the process document and if you cannot find a process document for the thing you do please let me know and then it means that we should create one or you can ask hey I cannot find a process document for this thing do you think we have one or should I create one and once we have a process document that describes exactly each step that you need to make then you go ahead and do this so please don't improvise unless it's necessary so then this way we if we do it this way we will avoid like different mistakes errors yeah so it's fine indeed sometimes we need to improvise but for now let's try to first find a process document a relevant process document and then if we don't we see what we should do about that",Process Documentation Guidelines,"I would like to ask you for a favor. When you want to do something, please first try to locate the relevant process document. 

If you cannot find a process document related to your task, please let me know. This indicates that we may need to create one. Alternatively, you can ask, ""I cannot find a process document for this task—do we have one, or should I create it?""

Once we have a process document that clearly outlines each step required, you can proceed with your task. 

Please avoid improvising unless absolutely necessary. Following this approach will help us minimize mistakes and errors. While there are times when improvisation is needed, let's prioritize finding the appropriate process document first. If we can't find one, we can then determine the next steps."
"audio_159@21-08-2024_10-12-24.ogg,audio_160@21-08-2024_10-12-35.ogg,audio_161@21-08-2024_10-12-48.ogg","159,160,161",2024-08-21 10:12:24,"So, if you need to pay an invoice, I'll explicitly tell you that you need to do that. Usually, either I already pay and just get an invoice as a result of that, or, yeah, I pay it myself. So, for example, from Valeria, when I get an invoice from Valeria, then, yeah, I just pay it myself. Because you also don't have access to all the tools. So, I use VICE for that. It doesn't matter. Many things I do myself. And then, what you need to do is just declare the expenses, make sure they are in the spreadsheet. And usually, if something is in the spreadsheet, it's already paid. And when you need to pay for something, then I explicitly ask you to do that. And then there is a process document for doing that, how you need to pay in FINOM. What do you mean incoming invoices are not in Venom? like i don't think they should be there or what exactly what do you exactly mean",Payment Process and Invoice Management,"If you need to pay an invoice, I will specify that you need to do so. Typically, I either pay the invoice upfront and receive a confirmation later, or I handle the payment directly. For example, when I receive an invoice from Valeria, I pay it myself since you don’t have access to all the necessary tools.

I primarily use VICE for this process, but ultimately, I manage many tasks personally. Your responsibility is to declare the expenses and ensure they are recorded in the spreadsheet. Generally, if an expense appears in the spreadsheet, it's already been paid. 

When you need to pay for something, I will clearly instruct you to take action. There is also a process document available that outlines the steps for making payments in FINOM. 

Regarding your comment about incoming invoices not being in Venom, could you clarify your concerns? I'm uncertain if they should be included or what you mean specifically."
"audio_162@21-08-2024_11-25-25.ogg,audio_163@21-08-2024_11-26-07.ogg","162,163",2024-08-21 11:25:25,"Please don't use Google. This is outdated. I recently sent you a link to, I think, VICE. And in VICE, we can select a specific date at which the transaction happened. Specific day. And then we can know the rate, exchange rate, on that day. Because with Google, it gives you the exchange rate today, but that thing was in the past. For now, actually, maybe it's okay. I don't think it changed significantly over a month. But please update the process document. Or we actually should create a new process document that shows how to convert currencies with historical rates. And then we can simply link that process document in the process document you show in the screencast video. I think the deleted one was a duplicate, accidental duplicate, so please remove the line from the spreadsheet.",Currency Conversion Process Update,"Please avoid using Google for currency conversion, as it provides outdated information. Instead, I recently shared a link to VICE, which allows us to select a specific date for the transaction. This way, we can accurately find the historical exchange rate for that particular day.

While the current rates may not have changed significantly over the past month, it is essential to update the process document. Alternatively, we should consider creating a new process document that outlines how to convert currencies using historical rates. We can then link this new document in the existing process document that you presented in the screencast video.

Additionally, I believe the deleted item in the spreadsheet was an accidental duplicate. Please remove that line to streamline our records."
audio_164@21-08-2024_11-27-51.ogg,164,2024-08-21 11:27:51,"Everything looks fine, please also check in Finom and in Revolut if we had any income or expenses that are not reflected in the bookkeeping spreadsheet. So if there was a payment in Finom or Revolut but it's not there, we need to add it and also make sure we have an invoice for that in Dropbox. And likewise, if there is incoming money, it's very important to also declare this. I think I mentioned that this is super important, more important than anything else, that we do not forget to include any income we received. So please go through Finom and Revolut and see what are the transactions for that month and if there are any transactions that are not in the spreadsheet. Not all the transactions are in Finom and Revolut, because sometimes I pay from my personal card, sometimes I make... Like sometimes payments do not come from Revolut or Finom and this is fine, but like if there is any incoming things, we need to make sure they are in the bookkeeping document.",Financial Review and Reconciliation,"Please check Finom and Revolut for any income or expenses that are not recorded in the bookkeeping spreadsheet. If you find any payments in these accounts that are missing from the spreadsheet, we need to add those entries and ensure we have corresponding invoices saved in Dropbox.

It is crucial to declare any incoming money accurately. This aspect is extremely important; we must not overlook including any income we received. 

Take the time to review the transactions in Finom and Revolut for this month to identify any discrepancies with our records. Keep in mind that not all transactions will appear in these accounts. There are instances when I make payments using my personal card, and some payments might not originate from either Finom or Revolut. 

However, we must ensure that any incoming funds are documented in the bookkeeping records to maintain accuracy."
audio_165@21-08-2024_11-28-52.ogg,165,2024-08-21 11:28:52,"Also, I think I already asked you, and you probably do that already, but in case I didn't and you didn't do this, let's create a document that describes how exactly we do the reports. Like very similar to, or like even better, maybe let's create a template in Trello that step-by-step describes what exactly we need to do, right? And then, like for you, next time you do it, you just clone a template and you just tick all the boxes until it's done, then it should be way easier for you to follow that.",Creating a Reporting Template in Trello,"I think I might have asked you this before, but just in case, let’s create a document that outlines how we generate our reports. 

It would be even more effective to develop a step-by-step template in Trello that clearly describes each part of the reporting process. 

This way, the next time you work on it, you can simply clone the template, check off the necessary tasks, and complete it more easily."
"audio_166@21-08-2024_18-52-57.ogg,audio_167@21-08-2024_18-53-45.ogg,audio_168@21-08-2024_18-53-55.ogg","166,167,168",2024-08-21 18:52:57,"For this one, it's very important to add only those who opted in so when they register There is a checkbox subscribe to Datadogs Club newsletter. So we select only those who ticked that checkbox So for that one, we should check which one we haven't uploaded, but we should do this too for every event. And I'm not sure if Francis was doing this or not, so we will need to check to look back and see for which events we did not do this and retroactively do this for past events. So for now add this to Todo and for now only do it for all the new events. But yeah, we will do this in the future. So instead of Eventbrite, it should be Luma, but with Luma it's possible to do all that. No, Pavel does not work with us anymore.",Important Updates on Registration Process,"For the registration process, it's crucial to include only those who have opted in. When individuals register, they should see a checkbox to subscribe to Datadog's Club newsletter. We should only select those who have ticked that checkbox.

To ensure we are compliant, we need to check which events haven't had this process uploaded. This is something we should implement for every event moving forward. I'm unsure if Francis has been handling this, so we will need to review previous events to determine which ones lack this step and address it retroactively.

For now, please add this task to our to-do list and focus initially on the new events. Going forward, we'll handle this for past events as well.

Additionally, instead of using Eventbrite for registrations, we will switch to Luma. Unlike Eventbrite, Luma allows us to manage this subscription process effectively. Please note that Pavel is no longer working with us."
