filename,number,datetime,text,title,edited
audio_1@04-07-2023_10-06-31.ogg,1,2023-07-04 10:06:31,"Maria from YLABS is asking about the USD account. It means they probably want to pay in American dollars in USD. So what we can do is we can go to Google and check how much, I don't remember what was the exact price for that invoice for YLABS. So you can take whatever price is there and create or update an invoice. And in this invoice you can just go to Google and then type whatever money in Euro and then convert it to USD and then take whatever sum was there and update the invoice to include USD and on this invoice use the IBAN from Revolut. Yes, so I'm not sure which IBAN they have. Maybe it's not the right one because I used to have a, I still have a private Revolut account and previously they used it for paying us. So this time we need to use Revolut from the company and maybe this is what they used last time. But you can just include this on the invoice and then send them an updated version to them. So the new updated invoice should have a USD sum there converted from Euros and then the Revolut IBAN there.",Invoice Update for YLABS,"Maria from YLABS has inquired about the USD account, indicating that they likely want to make a payment in American dollars. To address this, we can start by checking the amount for the invoice related to YLABS.

Once we determine the exact amount, we can convert the figure from Euros to USD. To do this, we can simply use Google to find the current exchange rate. After obtaining the USD amount, we need to update the invoice accordingly.

It’s important to ensure that the invoice includes the correct IBAN from our company Revolut account. Previously, I used my private Revolut account for payments, but this time we need to use the company account. I'm not sure if they have the correct IBAN from the corporate account, so we should verify this.

Finally, we will send them the updated invoice that includes the converted USD amount and the correct Revolut IBAN."
audio_2@23-08-2023_13-35-55.ogg,2,2023-08-23 13:35:55,"Hey, I just added, I just closed one of the newsletter slots in September, please send them, please start the invoice process and the newsletter process with them because they ask how they can pay and how they can prepare the materials.",Newsletter Slot Confirmation,"I just closed one of the newsletter slots for September. Please initiate the invoice process for the client. 

Additionally, the client has inquired about how they can make the payment and what materials they need to prepare. Please provide them with the necessary information."
"audio_3@20-11-2023_15-54-31.ogg,audio_4@20-11-2023_15-55-06.ogg","3,4",2023-11-20 15:54:31,"So what I was going to write here is, no, we unfortunately cannot send the YouTube links in advance, only the link to our channel. And the reason for that is because the way YouTube and Zoom integrate is in Zoom when we start streaming, only then we find out what is the YouTube ID or YouTube URL. So potentially, we can send the link to our channel right now or five minutes before the event we start the stream, usually it's five to ten minutes before the event, then we can send the link. And if somebody from their team is around, then they can make the post. Otherwise, I don't know, maybe they can just post the link to the channel. But you can tell here that we will tag weights and biases when we make the announcement. We'll make the announcements on social media and they can just retweet them, repost them.",YouTube Links and Streaming Procedure,"Unfortunately, we cannot send the YouTube links in advance; we can only provide the link to our channel. The reason for this limitation is due to how YouTube and Zoom integrate with one another. When we start streaming on Zoom, that’s when we receive the YouTube ID or URL.

We can send the link to our channel either right now or about five to ten minutes before the event starts. If someone from their team is available at that time, they can post the link. Otherwise, they might just post the link to our channel.

Additionally, we will tag Weights and Biases when we make the announcement. These announcements will be shared on social media, and their team can simply retweet or repost them."
audio_5@27-11-2023_15-30-31.ogg,5,2023-11-27 15:30:31,"So, I know that right now for Luma we use square banners, and previously we used rectangular banners for Eventbrite, and the thing is that the Eventbrite banners we use do not fit well to YouTube because we have these black strips. So I wanted to ask you to coordinate with Valeria to update the template we have for the banners, for the rectangular banners, so instead of using the old Eventbrite banners we update them to fit the YouTube dimensions, YouTube thumbnails, so then when we create YouTube thumbnails we don't have these black strips. Yeah, please check with Valeria about that.",Updating Banner Templates for YouTube,"Currently, Luma uses square banners, while we previously utilized rectangular banners for Eventbrite. However, the Eventbrite banners do not fit well on YouTube, resulting in unsightly black strips.

I would like you to coordinate with Valeria to update our template for the rectangular banners. Instead of using the old Eventbrite design, we should adjust it to suit YouTube's dimensions for thumbnails. This way, when we create YouTube thumbnails, we can avoid those black strips. Please check in with Valeria about this change."
audio_6@09-12-2023_17-35-55.ogg,6,2023-12-09 17:35:55,"Hey, Francis, what would be convenient if you kept using the spreadsheet that you typically use, but then in addition to that spreadsheet, could send me a Google document where for each day you include a sum of total hours per day, and then also the sum for the entire week. So from Saturday till Friday, right? And then this way, like right now, this document is just too large. And it's very difficult to find things there. So then for summaries for statistics, I would check the spreadsheet. But for weekly reports, it would be convenient to use it in this form, right? Yeah.",Weekly Hours Report Format,"Hey Francis, I have a suggestion regarding the tracking of hours. It would be helpful if you continued using the spreadsheet you typically use. In addition to that, could you send me a Google document?

In this document, please include a summary for each day, detailing the total hours worked, as well as a cumulative total for the entire week, from Saturday to Friday. 

The reason for this change is that the current document is quite large and makes it challenging to locate specific information. For summary statistics, I will still refer to the spreadsheet, but having a weekly report in this new format would be more convenient. Thank you!"
audio_7@10-01-2024_14-23-20.ogg,7,2024-01-10 14:23:20,"Actually, I cannot find this event in our meetup group. I think we had it. Maybe we did not. I cannot find it. So what you can do is find, we had this recent event, introduction to Data Engineering Zoom Camp. Just copy that and replace it instead of join us for a QA session. Write that the course is starting soon and maybe adjust the wording. So what we will do in this session is we will discuss the content of the course and we will answer questions. So yeah, that's roughly it. So this is what you can mention in the details. You can just go ahead and create the event and then send me the details for checking. But I think the important thing is not what is inside but actually that we announce it and then we can iterate on the content. For the picture, you can just take the same picture as we had but instead of saying introduction to Data Engineering Zoom Camp, just write Data Engineering Zoom Camp 2024. Yeah, that's all.",Event Announcement for Data Engineering Zoom Camp,"I could not locate the event in our Meetup group, so I'm unsure if we actually had it scheduled. However, we recently hosted an event titled ""Introduction to Data Engineering Zoom Camp."" Please replace the mention of the QA session with this event title. Make sure to note that the course is starting soon and adjust the wording accordingly.

In this session, we will discuss the course content and answer any questions attendees may have. This is the main point to communicate in the event details. Go ahead and create the event, and then send me the details for review. 

It's important to focus on announcing the event rather than getting caught up in the specifics initially; we can refine the content later. For the event picture, please use the same image as before, but change the title to ""Data Engineering Zoom Camp 2024."" 

That covers everything!"
audio_8@10-01-2024_18-02-57.ogg,8,2024-01-10 18:02:57,"So the reason we don't create a luma event, but create a meetup event is because we have a lot of followers on meetup So they will see on luma not so much yet. So I just want to have an extra Traffic source, let's say for the course. Yeah",Maximizing Event Visibility,"We choose to create a meetup event instead of a luma event because we have a larger following on Meetup. This way, more people will see the event, as our presence on Luma is still growing. By utilizing Meetup, we ensure an extra traffic source for the course."
audio_9@15-01-2024_20-31-17.ogg,9,2024-01-15 20:31:17,"It just occurred to me, have we sent a template to the next week's sponsors? I just don't remember seeing it, maybe I missed it, but if we didn't, it would be good to send it to Weights and Biases.",Sponsor Template Follow-Up,"It just occurred to me: have we sent a template to the sponsors for next week? I don't recall seeing it, and it's possible I missed it. 

If we haven't sent it yet, it would be a good idea to reach out to Weights and Biases."
audio_10@16-01-2024_23-48-58.ogg,10,2024-01-16 23:48:58,"Please set this up, and it should be the same link as we used for this week, yesterday, for the introduction. So, and Pink Matt, to find out what's his email, so you can set it up. You don't need to create any events, except, yeah, except you need to create an event in the Data Engineering Zoom Camp calendar. I don't know if you have access to that calendar. If you don't, let me know, and I will give you access to that calendar and other calendars from our courses. But at the very least, please just schedule it, and then we'll see what to do next.",Setup Instructions for Upcoming Meeting,"Please set up the same link we used yesterday for the introduction. Additionally, we need to find Pink Matt's email so you can include him in the setup.

You don't need to create any events, except for one in the Data Engineering Zoom Camp calendar. Let me know if you don't have access to that calendar, and I will provide it, along with access to other course calendars.

At the very least, please schedule the event, and we can determine the next steps afterward."
"audio_11@17-01-2024_17-18-32.ogg,audio_12@17-01-2024_17-18-36.ogg","11,12",2024-01-17 17:18:32,I have added the event to the card. I have added the event to the calendar with Matt.,Event Update,"I have added the event to the card. 

Additionally, I have added the event to the calendar with Matt."
"audio_13@22-01-2024_17-12-10.ogg,audio_14@22-01-2024_17-12-50.ogg","13,14",2024-01-22 17:12:10,"Please check how many campaigns, email campaigns, weights and biases had last year. Cause in the contract, the sponsorship contract, we had six and lately they added two. So I'm wondering if these two are extra ones. So if they are, please prepare a invoice for them. Yeah. And also please check like if there are any due invoices. I think AI Infrastructure Alliance hasn't paid us for like two quarters. Please check with them too to see if they can pay. And yeah, when you write to weights and biases with, yeah, maybe let's, yeah, let's create, I'll send another voice message. So I just lost my thought. So I wanted to ask you to ask Agata if they plan to have any more email campaigns this year. And if yes, ask her which slots they want to book because we are, so write something like this. Hi Agata, right now we are planning our activities for 2024 and we were wondering if you want to run any email campaigns with us. If yes, please let us know and we will book the slots for you. Something like that.",Email Campaigns and Invoices,"Please check how many email campaigns Weights and Biases had last year. In the sponsorship contract, we initially outlined six campaigns, but they recently added two more. I’d like to confirm if these two are considered extra. If they are, please prepare an invoice for them.

Additionally, could you verify if there are any outstanding invoices? I believe the AI Infrastructure Alliance hasn’t paid us for the past two quarters. Please follow up with them to see if they can settle this.

Lastly, when you write to Weights and Biases, I’d like you to ask Agata if they plan to have any more email campaigns this year. If they do, inquire about the specific slots they would like to book. You could frame it like this: “Hi Agata, we are currently planning our activities for 2024 and would like to know if you intend to run any email campaigns with us. If so, please let us know, and we will reserve the slots for you.”"
audio_15@24-01-2024_13-54-25.ogg,15,2024-01-24 13:54:25,so the title doesn't really reflect the content is this prepared by the guest or Johanna I guess it's from the guest so please ask him to adjust the title so it reflects better the content otherwise apart from that it's ready,Title,"The current title does not accurately reflect the content of the material. It appears to be prepared by the guest or Johanna. 

Please ask the guest to adjust the title so that it better aligns with the content of the piece. 

Aside from that, everything else is ready for submission."
audio_16@25-01-2024_21-10-06.ogg,16,2024-01-25 21:10:06,"We should reach out to all the past clients that used a newsletter and also others that didn't. Like for example, DoubleCloud, I don't think they, I'm not sure if they used a newsletter. Basically all the clients we had. Yeah, so the newsletter clients plus DoubleCloud, who else? Yeah, so let's compile a list with emails and names and also have created template. Like, hey, something like, hey, you run a newsletter campaign with us at some point. Now we're making plans for 2024. And yeah, let us know if you want to run any other campaigns with us, something like that. So let's create a template. Let's come up with a list and we should start sending these emails cause I look at the plan for the schedule for the newsletter and I see that, yeah, we need to fill a lot of slots. And I think we should start with existing clients. And in the meantime, I'll try to come up with a way that you can help me also reach out to potential new clients.",Reaching Out to Clients for 2024 Newsletter Plans,"We should reach out to all the past clients who used our newsletter, as well as those who didn't. For example, I'm not certain if DoubleCloud utilized a newsletter, but we should include them on our list. Essentially, we want to contact all our former clients.

Let's compile a list that includes their names and email addresses. Additionally, we need to create a message template. It could say something like, ""Hi, you previously ran a newsletter campaign with us. We are making plans for 2024 and would love to know if you're interested in running any new campaigns."" 

Once we have the template and the list ready, we should start sending these emails. I reviewed the schedule for our newsletter and noticed that we have many slots to fill. Prioritizing our existing clients will be a good start.

Meanwhile, I'll also think of ways you can assist me in reaching out to potential new clients."
audio_17@25-01-2024_22-09-57.ogg,17,2024-01-25 22:09:57,"You can write something like, hey, Sahar, we've noticed that you are planning an event and we wanted to let you know that we will be happy to help you promote the event. We have a community with how many, I don't remember how many members in Slack, so check it out. And we have a newsletter with some number of subscribers, also check it in MailChimp. So if you want to promote with us, let us know and we'll be happy to help you. Something like that. So let's have this as a template and then run it by me and then if it's fine, we can send this to Sahar tomorrow.",Event Promotion Offer,"Hi Sahar, 

We've noticed that you are planning an event, and we wanted to let you know that we would be happy to help you promote it. 

We have a community on Slack with a considerable number of members, and we also have a newsletter that reaches a significant number of subscribers through MailChimp. 

If you're interested in promoting with us, please let us know, and we’ll be happy to assist you. 

Let's use this as a template, and once you review it, we can send it to Sahar tomorrow."
audio_18@25-01-2024_22-13-17.ogg,18,2024-01-25 22:13:17,"Also, please ping AI Infrastructure Alliance about the overdue payments. I pinged Maria in Slack separately, but an email wouldn't hurt.",Payment Reminder for AI Infrastructure Alliance,"Please reach out to the AI Infrastructure Alliance regarding the overdue payments. I have already messaged Maria separately on Slack, but a follow-up email would also be beneficial."
audio_19@26-01-2024_08-48-46.ogg,19,2024-01-26 08:48:46,"I know you already have a lot of things that I sent you yesterday Also, I wanted to remind you to send the report for all the things you've done since Last Saturday, right? So it's from Saturday till Friday and I will set up a reminder So then every Friday in the morning you will get That yeah",Report Reminder and Weekly Summary,"I know you already have a lot of information that I sent you yesterday. 

I wanted to remind you to send the report detailing everything you have accomplished since last Saturday. This report should cover activities from Saturday until Friday. 

To help with this, I will set up a reminder. You will receive a notification every Friday morning to ensure you don't forget."
audio_20@26-01-2024_12-16-52.ogg,20,2024-01-26 12:16:52,"Also, for this webinar with Sahar, let's use the same subject. So it's Quack plus Data Talks Club, no need to include anything else. And then I'd say we've seen that you're planning an event and we wanted to reach out to say that we can help you promote it. We have a community with 48k plus members on Slack and we have a newsletter with more than 86k subscribers. Let us know if you would like to collaborate with us on promoting the event. Yeah, and that's it. So please send me another one.",Webinar Promotion with Sahar,"For the upcoming webinar with Sahar, let’s use the same subject: Quack plus Data Talks Club. There’s no need to include anything else.

We've noticed that you’re planning an event, and we wanted to reach out to offer our assistance in promoting it. Our community consists of over 48,000 members on Slack, and we have a newsletter with more than 86,000 subscribers. 

Please let us know if you would like to collaborate with us on promoting the event. 

That’s all for now. Please send me another update."
audio_21@29-01-2024_13-56-41.ogg,21,2024-01-29 13:56:41,"Too bad, I noticed it only now. So the reason I noticed is because there is another email about Quack and Amit. And then I thought, wait a minute, like, why do we have two emails to Quack? And then I come, fuck, it's actually not Quack. So we need to be more careful. So when we write to clients, sponsors, potential sponsors, we also check the domain name. Like here is sahar, whatever, at iguazio.com. And then we need to make sure that the subject matches, actually matches the domain name, right? And then we send. I think we should start maybe preparing a process document for reaching out to sponsors with some templates. So let's start that. Mention that step. And yeah, we'll add more information there. Because I also want to start, like, we have this CRM with many, many things. And I want to start using it more. I've used it a couple of times recently. But I want to start using it more for finding sponsors.",Subject: Improving Communication with Sponsors,"I just realized something important. I noticed it while going through another email about Quack and Amit. I thought it was strange that we had two emails regarding Quack, only to discover that one wasn't actually from Quack. This highlights the need for us to be more careful when contacting clients and potential sponsors.

Moving forward, we should always verify the domain name of the email sender. For example, if we see an email from sahar@iguazio.com, we need to ensure that the subject line aligns with the domain name before we send any communication.

Additionally, I propose that we start preparing a process document for reaching out to sponsors. This document can include some templates to streamline our communication. I believe it's essential to outline this step.

Furthermore, I want us to utilize our CRM system more effectively. I have used it a couple of times recently, but I think it can help us significantly in finding sponsors if we make it a routine part of our process. Let's prioritize this going forward."
audio_22@03-02-2024_16-28-05.ogg,22,2024-02-03 16:28:05,"Did we send it in the voice? I asked you to prepare for the course workshops for two days for 1,000. I just don't remember seeing it. Maybe I just missed it.",Course Workshop Preparation,"Did we send the information in the voice message? I asked you to prepare for the course workshops over two days for a total of 1,000 participants. However, I don’t remember seeing it. It’s possible that I just missed it."
audio_23@03-02-2024_21-27-40.ogg,23,2024-02-03 21:27:40,"Please create an invoice for $5,000, US dollars, for Saturn Cloud. I think we should already have Saturn Cloud in our address book. If not, let me know. So, in this $5,000, $2,000 should be for sponsoring the course, Machine Learning Zoom Camp, and $3,000 for sponsoring a competition. And then include a payment link. I don't remember how much percent. Okay, for this one, let's not add percent, because previously the arrangements we had with them did not include any fees for processing the payment link, so just create that. And then, once it's ready, make sure that, in case they want to pay, not with the payment link, but with the address. It's the Revolute email. And then I'll try to find the email right now that you want to use for sending.",Invoice Creation for Saturn Cloud,"Please create an invoice for $5,000 USD for Saturn Cloud. We should already have Saturn Cloud in our address book; if not, please let me know.

The invoice should allocate $2,000 for sponsoring the Machine Learning Zoom Camp course and $3,000 for sponsoring a competition. Additionally, please include a payment link with the invoice. 

For this invoice, do not include any processing fee percentage. Previously, our arrangements with them did not include any fees for processing the payment link. 

Once the invoice is ready, ensure that you include the option for payment via the Revolut email address, in case they prefer not to use the payment link. I will find the appropriate email to use for sending shortly."
audio_24@07-02-2024_19-16-28.ogg,24,2024-02-07 19:16:28,"So our accounts accountants tell me Have told me that We have not sent them the documents so they expected that we would use the link the new way of uploading documents and We sent them an email. So can you please redo it for? January using the upload link and also send it with Like the February one or wait, we don't have February on so yeah for January, please send it with the new upload link Because they asked me to do it as soon as possible",Document Submission Update,"Our accountants have informed me that we haven't sent them the required documents. They expected us to use the new upload link for submitting these documents, but we sent them an email instead. 

Please redo the submission for January using the upload link. Additionally, since we don't have the documents for February yet, just focus on January for now. They have requested that this be done as soon as possible."
audio_25@13-02-2024_13-58-12.ogg,25,2024-02-13 13:58:12,"They both just sent me a connection request and I think they have an interesting profile. So what you can write to both of them is, like, hi, name, thanks for your connection request and reaching out. I took a look at your profile and I found it quite interesting. So I was wondering if you'd be interested in being a guest at our podcast. And then you sent a link that you usually send that describes our events and a link to our podcast, datadogs.club.html, something like that. It's in the document, in the Google document. And let's create a new template. So this is for people who send a connection request to me, then this is something we can send them. And also, please send me the template we sent now. I think we might need to update it slightly. I want to update it. So please send me the template. I'll make some adjustments.",Connection Request Response Template,"I received two connection requests that caught my attention because of their interesting profiles. 

For each of them, we can use the following message: “Hi [Name], thank you for your connection request and for reaching out. I found your profile quite intriguing and was wondering if you would be interested in being a guest on our podcast.” 

Be sure to include the link to our events and the link to our podcast, which is found in the Google document (datadogs.club.html).

Additionally, I would like to create a new template specifically for individuals who send connection requests to me. 

Also, please send me the current template we are using. I believe it requires some slight updates, and I would like to make those adjustments."
